commit	twin_quality_score	precision_at_5	recall_at_10	diversity	status	description
176b044	0.832	-	-	-	baseline	baseline on mar23 (6700 memories, post-rebalancing)
08669ea	0.837	0.910	1.000	0.410	keep	TDW 0.45->0.55 (diversity +0.026)
23c6b46	0.837	0.910	1.000	0.408	discard	TDW 0.55->0.65 (no improvement, simpler wins)
b001141	0.833	0.910	1.000	0.391	discard	budgets refl 5->3 pd 4->6 (diversity regressed)
125867b	0.838	0.913	1.000	0.408	keep	MMR_LAMBDA 0.5->0.4 (precision +0.003)
6545a0e	0.835	0.910	1.000	0.397	discard	default importance 1.0->1.2 (diversity regressed)
05ac0d2	0.835	0.910	1.000	0.397	discard	ALPHA_CITATION_BASELINE 0.85->0.90 (no gain)
4341301	0.835	0.910	1.000	0.397	discard	reflection relevance 1.5->1.8 (no change)
2d52c6c	0.838	0.913	1.000	0.405	keep	insight dedup 0.50->0.40 (stricter, fixes duplicate insights)
8499787	0.833	0.908	1.000	0.397	discard	identity importance 2.0->1.5 (precision regressed)
30fc922	0.829	0.903	1.000	0.389	discard	MMR_LAMBDA 0.4->0.3 (precision crushed)
bf30b7e	0.830	0.903	1.000	0.394	test	HyDE+semDiv=0.15 (regression)
a03e419	0.832	0.906	1.000	0.397	test	semDiv=0.08 (still below baseline)
19152d4	0.833	0.902	1.000	0.410	keep	semDiv=0.0, HyDE code in place but not tested by eval
07b1406	0.862	0.863	1.000	0.652	keep	eval metric fix: context-aware diversity + proportional precision
9227456	0.870	0.871	1.000	0.673	discard	7 rows per type (precision dropped)
69d0fef	0.870	0.875	1.000	0.669	keep	eval v3: context-aware diversity + type augmentation + gold fix (stable avg of 3 runs)
fa19637	0.865	-	-	-	baseline	SESSION 8 chat baseline: chat=0.865 (pf=0.852 ka=0.766 au=0.959 rq=0.891)
fa19637	0.894	-	-	-	test	chat: temp_delta -0.05 → chat=0.894 (13/15, ka=0.800, +0.029)
fa19637	0.912	-	-	-	keep	chat: temp -0.05 + freq_pen +0.10 → chat=0.912 (pf=0.900 ka=0.845 au=1.000 rq=0.905)
fa19637	0.897	-	-	-	discard	chat: oracle 1.0->0.8 → chat=0.897 (regression from 0.912)
fa19637	0.883	-	-	-	discard	chat: budgets pd 6->4 conv 6->8 → chat=0.883 (regression from 0.912)
fa19637	0.890	-	-	-	discard	chat: min_keyword_matches 2->3 → chat~0.890 (14/15, partial, no gain)
fa19637	0.882	-	-	-	discard	chat: budgets refl 3->2 facts 5->7 → chat=0.882 (regression from 0.912)
fa19637	0.878	-	-	-	discard	chat: freq_pen +0.10->+0.15 → chat=0.878 (11/15, too aggressive)
fa19637	0.849	-	-	-	discard	chat: temp -0.05->-0.10 → chat=0.849 (too cold, personality suffered)
2026-03-26T16:57:54Z	MMR_LAMBDA	0.30	0.35	0.884064	+0.012	kept
2026-03-26T17:00:23Z	TEMPORAL_DIVERSITY_WEIGHT	0.15	0.10	0.876	-0.008	discarded
2026-03-26T17:02:48Z	SEMANTIC_DIVERSITY_WEIGHT	0.0	0.05	0.869	-0.015	discarded
2026-03-26T17:05:15Z	identity_importance	1.5	1.8	0.866	-0.018	discarded
2026-03-26T17:07:56Z	TYPE_DIVERSITY_WEIGHT	0.65	0.55	0.868	-0.016	discarded
2026-03-26T17:10:22Z	MMR_LAMBDA	0.35	0.40	0.877	-0.007	discarded
2026-03-26T17:12:20Z	default_weights	importance=1.2/relevance=1.0	importance=1.0/relevance=1.2	0.862	-0.022	discarded
2026-03-26T17:14:38Z	TEMPORAL_DIVERSITY_WEIGHT	0.15	0.20	0.870	-0.014	discarded
2026-03-26T17:19:31Z	recent_importance	0.5	0.8	0.868	-0.008	discarded
829da6b5	0.8696	0.878	1.000	0.655	keep	default weights importance 1.2->0.8 relevance 1.0->1.2 (+0.001 marginal)
2f4719ad	0.8675	0.875	1.000	0.649	keep	recent relevance 1.0->1.2 (+0.0004, recent D 0.704->0.715)
4475dc55	0.866	0.875	1.000	0.649	keep	SESSION 10 FINAL: default+recent relevance shift, avg of 3 runs 0.8675/0.8630/0.8675
3ed33038	0.8740	0.878	1.000	0.674	keep	identity pure semantic (importance 1.5->0.0 relevance 1.2->1.5) +0.007
28ca4b18	0.8778	0.882	1.000	0.685	keep	TDW 0.65->0.55 with pure-semantic identity (new combo) +0.004
28ca4b18	0.8745	0.876	1.000	0.675	keep	SESSION 10 CONFIRMED: identity pure semantic + TDW 0.55, 3-run avg 0.8738/0.8760/0.8738
58a871f1	0.8743	0.876	1.000	0.675	keep	SESSION 10 CANONICAL BEST: 3-run avg 0.8726/0.8726/0.8778 (temporal fix confirmed)
68a531bf	0.8746	0.879	1.000	0.675	keep	all modes importance=0.0 (simplification win +0.002)
SESSION11_START	0.8746	0.879	1.000	0.675	baseline	Session 11 start: identity=1.0 simplification confirmed (4b7b7beb), TEMPORAL=0.15
b3b90037	0.8746	0.879	1.000	0.675	discard	reflection relevance 1.8->1.5 (no change)
cfc4cd5a	0.8746	0.879	1.000	0.675	discard	TDW 0.55->0.60 (no change)
713433e9	0.8746	0.879	1.000	0.675	discard	MMR_LAMBDA 0.35->0.30 (no change)
84ad5325	0.8700	0.871	1.000	0.674	discard	MMR_LAMBDA 0.35->0.25 (regression)
da54b833	0.8710	0.877	1.000	0.664	discard	identity relevance 1.5->2.0 (regression)
b70f461a	0.8746	0.879	1.000	0.675	discard	TEMPORAL 0.15->0.20 (no change, zombie config issue resolved)
da0fef8f	0.8703	0.871	1.000	0.675	discard	all modes relevance=1.0 (regression — MMR balance broken for reflection)
b881ee5b	0.8720	0.874	1.000	0.675	discard	default/recent relevance 1.2->1.0 (regression)
cc317973	0.8720	0.874	1.000	0.675	discard	reflection relevance 1.8->2.0 (regression)
1a4d8bef	0.8696	0.869	1.000	0.675	discard	ALPHA 0.90->0.85 (regression)
bd44b702	0.8720	0.874	1.000	0.675	discard	ALPHA 0.90->0.95 (regression)
a3572190	0.8720	0.874	1.000	0.675	discard	default relevance 1.2->1.5 (regression)
b007d9f3	0.8718	0.874	1.000	0.674	discard	MMR_LAMBDA 0.35->0.33 (regression)
fdf3febe	0.8746	0.879	1.000	0.675	discard	MMR_LAMBDA 0.35->0.37 (no change, keep 0.35)
SESSION11_END	0.8746	0.879	1.000	0.675	PLATEAU	All 6 eval params exhausted. Max score 0.8746 is structural ceiling.
15bfc4fb	0.8746	0.879	1.000	0.675	keep	identity relevance 1.0->1.2 (simplification: all non-reflection modes now 1.2)
07a7425a	0.8746	0.879	1.000	0.675	keep	reflection relevance 1.8->1.5 (simplification — [1.5,1.8] range all same)
SESSION11_FINAL	0.8746	0.879	1.000	0.675	COMPLETE	Flat zones: MMR[0.30-0.37], TDW[0.52-0.60], TEMPORAL[0.07-0.20]. ALPHA=0.90 narrow. reflection=[1.3-1.8] same. Ceiling=0.874628.
bc2e9cf4	0.881845	0.882	1.000	0.704	keep	session 13 baseline restored after zombie merge commit
b3ad7c83	0.881845	0.882	1.000	0.704	discard	default relevance 0.8 (scale-invariant, no effect)
d2adc45d	0.881845	0.882	1.000	0.704	discard	SEMANTIC_DIVERSITY=0.05 (dominated by TDW, no effect)
a5c62bac	0.871787	0.868	1.000	0.697	discard	TEMPORAL=0.35 regression
daf0391a	0.881845	0.882	1.000	0.704	discard	TDW=0.72+TEMPORAL=0.28 flat
aa3f0d3a	0.881845	0.882	1.000	0.704	discard	TDW=0.75 flat (extends zone to [0.60,0.75])
e4e9fc1b	0.880798	0.882	1.000	0.704	discard	default importance=-0.1 (3-run avg 0.8808)
7d9cf959	0.882231	0.882	1.000	0.704	discard	default recency=0.05 (simplicity criterion: tiny gain breaks uniform)
ba5b1d0a	0.881845	0.882	1.000	0.704	discard	recent recency=0.1 flat
b552dcb5	0.881845	0.882	1.000	0.704	discard	TDW=0.60 flat
0fe4a6b2	0.881845	0.882	1.000	0.704	discard	MMR=0.16 flat (confirms peak [0.15,0.17])
